[
  {
    "id": "SPEC-003",
    "version": 1,
    "client": "northline-goods",
    "title": "Profit model and constraints",
    "role": "Data Analyst",
    "stage": "spec",
    "status": "approved",
    "brd_sections": [
      "R"
    ],
    "goal": "A profit model per product and category, so campaign targets are set against break-even ROAS instead of revenue.",
    "scope": [
      "Build margin by product",
      "Rank categories by margin",
      "Compare ROAS targets to break-even",
      "Add order costs to the profit model",
      "Add exclusions to campaign structure"
    ],
    "out_of_scope": [
      "Changing live campaign budgets",
      "Forecasting next year's margin"
    ],
    "acceptance_criteria": [
      {
        "id": "AC1",
        "text": "Every product in the sales export has a cost from the COGS source, or is listed as missing.",
        "verified_by": "agent_check"
      },
      {
        "id": "AC2",
        "text": "Break-even ROAS per category matches the client's stated values within 0.1, or the difference is explained.",
        "verified_by": "human_review"
      },
      {
        "id": "AC3",
        "text": "Order costs (shipping, returns, payment fees) are applied per order as the client described.",
        "verified_by": "human_review"
      },
      {
        "id": "AC4",
        "text": "No recommendation pushes a product or category the client excluded.",
        "verified_by": "agent_check"
      }
    ],
    "inputs_needed_from_client": [],
    "source_item_ids": [
      "R1",
      "R2",
      "R3",
      "R4",
      "R5"
    ],
    "source_work_item_ids": [
      "WI-R1",
      "WI-R2",
      "WI-R3",
      "WI-R4",
      "WI-R5"
    ],
    "depends_on": [],
    "risks": [
      "COGS lives in a store metafield; products without it would understate cost."
    ],
    "approval": {
      "by": "Avery Park",
      "at": "2026-10-25T13:55:00-07:00",
      "note": "Approved as drafted."
    },
    "rejection": null,
    "provenance": {
      "generated_by": "rules",
      "model": null,
      "generated_at": "2026-10-25T13:50:00-07:00",
      "inputs": [
        "data/out/brd.md",
        "data/out/work_items.json",
        "contracts/bundle.json",
        "contracts/sdlc/item_dependencies.json"
      ]
    }
  },
  {
    "id": "SPEC-005",
    "version": 1,
    "client": "northline-goods",
    "title": "Tools, feed and tracking requirements",
    "role": "Developer",
    "stage": "spec",
    "status": "draft",
    "brd_sections": [
      "F"
    ],
    "goal": "A checked map of how product, cost and conversion data move between the store, feed tool, Merchant Center and GA4, with risks flagged.",
    "scope": [
      "Document data-flow map and flag risks",
      "Review feed setup",
      "Check source-of-truth consistency",
      "Validate conversion value against profit"
    ],
    "out_of_scope": [
      "Rebuilding the feed",
      "Changing the store's product data"
    ],
    "acceptance_criteria": [
      {
        "id": "AC1",
        "text": "The data-flow map lists every source -> destination -> data -> frequency the client named.",
        "verified_by": "human_review"
      },
      {
        "id": "AC2",
        "text": "The feed review covers every Merchant Center account the client lists.",
        "verified_by": "agent_check"
      },
      {
        "id": "AC3",
        "text": "The conversion value definition is checked against the agreed profit definition.",
        "verified_by": "human_review"
      }
    ],
    "inputs_needed_from_client": [
      {
        "source_item_id": "A2",
        "question": "Invite our address to every Google Merchant Center account. Which accounts exist?"
      },
      {
        "source_item_id": "F5",
        "question": "Is product cost (COGS) filled in for all products in your store? List the custom labels used in the feed."
      }
    ],
    "source_item_ids": [
      "F1",
      "F2",
      "F3",
      "F4",
      "F5"
    ],
    "source_work_item_ids": [
      "WI-F1",
      "WI-F2",
      "WI-F3",
      "WI-F4",
      "WI-F5"
    ],
    "depends_on": [
      "SPEC-002"
    ],
    "risks": [
      "Feed review can't start until Merchant Center access is granted."
    ],
    "approval": null,
    "rejection": null,
    "provenance": {
      "generated_by": "rules",
      "model": null,
      "generated_at": "2026-10-25T13:50:00-07:00",
      "inputs": [
        "data/out/brd.md",
        "data/out/work_items.json",
        "contracts/bundle.json",
        "contracts/sdlc/item_dependencies.json"
      ]
    }
  }
]
